{
  "profileId": "US_VERIFICATION_SOFTHOLD_V1",
  "version": "1.0.0",
  "jurisdiction": "US",
  "verificationSources": ["hosted-adapter", "authority-mock", "cache"],
  "policyDefaults": {
    "degradedMode": "SoftHold",
    "maxFallbackDurationSeconds": 43200,
    "requireManualEscalationForTier": 2
  },
  "riskTiers": [
    {
      "tier": 0,
      "tierLabel": "Low",
      "decisionOnOutage": "AllowProvisional",
      "dispatchAuthorization": "Hold",
      "maxCacheAgeSeconds": 43200,
      "requiresHumanApproval": false
    },
    {
      "tier": 1,
      "tierLabel": "Medium",
      "decisionOnOutage": "HoldDispatch",
      "dispatchAuthorization": "Hold",
      "maxCacheAgeSeconds": 21600,
      "requiresHumanApproval": false
    },
    {
      "tier": 2,
      "tierLabel": "High",
      "decisionOnOutage": "HoldDispatch",
      "dispatchAuthorization": "Hold",
      "maxCacheAgeSeconds": 10800,
      "requiresHumanApproval": true
    },
    {
      "tier": 3,
      "tierLabel": "Critical",
      "decisionOnOutage": "Block",
      "dispatchAuthorization": "Blocked",
      "maxCacheAgeSeconds": 0,
      "requiresHumanApproval": true
    }
  ],
  "dispatchRules": {
    "reverifyBeforeDispatch": true,
    "reverifyWindowSeconds": 21600,
    "allowHazmatWhenDegraded": false
  },
  "signingRequirements": {
    "requireSignedRequests": true,
    "requireSignedResponses": true,
    "allowedAlgorithms": ["ED25519", "HMAC_SHA256"],
    "maxClockSkewSeconds": 45
  }
}
